"annotation_id","annotator","created_at","filename","highlight","id","lead_time","notes","review","sentiment","stars","type","uid","updated_at","url"
70,"1","2025-04-26T16:25:22.491488Z","./train/unsup/12101_0.txt","",12101,42.647,"","This film has a script so terrible that I reluctantly sat through the entire thing (which is mercifully brief) merely to see how it would play out.<br /><br />SPOILERS ABOUND!<br /><br />The film opens with a shot of a manzanita pine overlooking the ocean that immediately establishes the Monterey, California setting and calls to mind the 1961 Marlon Brando film ONE-EYED JACKS, a film with a very similar storyline that was also set near Monterey. We then see Jay Turner (Sterling Hayden) and Max Reno (Ted de Corsia) riding horses along the surf and learn they are fleeing from a robbery. They go into a cave that Reno calls a perfect hideout. Presumably the entrance to the cave is hidden when the tide is up. However, anyone looking for the men shouldn't have too much trouble finding their horses outside. Morever, Turner builds a fire inside the cave. Don't they worry about the smoke giving them away? (For my part, I'd worry about being drowned inside the cave during high tide.)<br /><br />The men talk and we learn that they've only recently met. They are very different types: Turner is satisfied with the $5,000 he's getting from the heist and wants to give up crime, but Reno wants to continue their partnership and is miffed by Turner's retirement. When Turner goes out to the surf to get a pot of water (What's the water for? Is he intending to use seawater for coffee?) Reno follows him and shoots him in the back. He then takes both horses and flees. This scene stunned me. Why didn't Reno shoot Turner inside the cave, where he could have retrieved the $5,000 and left Turner's body better hidden? Since he seemed not to have retried the money, what was the point of shooting Turner?<br /><br />The next ONE-EYED JACKS element in the film is the appearance of a beautiful young Mexican woman, Maria Salvador (Pamela Duncan), who likes hanging out at the beach alone. Maria drags Turner out of the surf and somehow gets him to her home, where she nurses him back to health. Predictably, Maria and Turner fall in love. Turner is mellowing but is also obsessed with tracking Reno down and returning him to Monterey, where he can be hanged for murder (i.e., murdering Turner). Maria disapproves, but Turner leaves, vowing to return.<br /><br />Meanwhile, Max Reno manages to set himself up nicely, under his own name, in a town called Delrey. It wasn't clear where Delrey is, but it seems to be in or near Texas. A long way from Monterey, California, but it makes some sense, as Reno doesn't appear to be worried about being caught by the law.<br /><br />We first see Reno when he is playing cards in a saloon and winning big. He's obviously cheating, and even the sheriff suggests as much, but he nevertheless wins a huge amount from the saloon's owner. (Would a real saloon owner ever play a complete stranger in a high-stakes poker game?) In a back-room scene, the saloon owner signs over half-interest in his place to Reno, who happens to have a ready-to-sign contract in his jacket pocket. Reno then shoots the man dead and gets away with claiming that the man drew on him. Playing a primitive version of DEADWOOD's Al Swearengen, Reno transforms the formerly tame Delrey saloon into a happening place with fast women, a piano player, and dishonest card dealers.<br /><br />If Delrey really is in Texas, it's a mystery how Turner finds the place, but he does. He makes a dramatic entrance in Reno's saloon and confidently pretends to be ""John York"" from El Paso when Reno confronts him. It's been a year since Reno has seen Turner, and he never knew Turner well to begin with, so he's not completely sure that York is Turner. He tries a few lame schemes to discover York's true identity. If Reno were Swearengen, he'd simply have York killed to be on the safe side. Eventually, he tries to do just that, but his schemes backfire. Turner ends up as deputy sheriff. Then, as acting sheriff, Turner saves Reno from a lynch mob and takes him back to Monterey. After Turner and Reno leave town, there is a curious sequence in which it becomes unclear what Turner's intentions are. Is he really taking Reno back to Monterey? Does he plan to kill Reno himself? Is he reverting to crime, with Reno as his partner? The answer is (a), and Turner delivers Reno to Monterey sheriff. He then rides back to the beach where he first encountered Maria and finds her pottering around the surf. They fall into each other's arms, but Maria is upset to learn what Turner has done to Reno. Despite the fact that Reno shot Turner in the back and later made several more attempts to have him killed, Maria thinks it wrong to have Reno tried for a murder that didn't take place. Seems like nitpicking, if you ask me. Turner asks Maria if she will love him, no matter what. She says yes, and we next see Turner being put in the same jail cell with Reno.<br /><br />Talk about a movie that doesn't deliver ... there is NO gun battle at Monterey! However, one of the film's few strengths is its ambiguous ending. I expected to see a scene in which Turner is let off the hook for being reformed, but that doesn't happen either. Instead, Reno welcomes Turner into his cell with open arms, forgives him ""for everything that you've done to me."" The film ends with Turner punching Reno out, as the credits begin to roll. Considering how heavy-handed everything in the script has subtle note. Will Is Turner be prosecuted? Will Reno be hanged? We can only guess. Meanwhile, I wouldn't be surprised if the naive Maria goes back to the beach to pick up more men.","Negative",0,"Train",25018,"2025-04-26T16:25:22.491503Z","http://www.imdb.com/title/tt0050465/usercomments"
71,"1","2025-04-26T16:26:03.940819Z","./train/unsup/49051_0.txt","",49051,41.308,"","The dopey, deadpan character sculptured by Leslie Nielsen is back in a ""James Bond-esque"" comedy as agent WD 40. There are more gag misfires in this movie, than a parking lot full of dead batteries. However, he's such a likeable guy, you can make it over the hump.<br /><br />Unfortunately, with the exit of the mad geniuses (The Zucker Bros. & Jim Abrahms), there's little here in this script to wave the pom-poms about. It's all been done too many times before.<br /><br />Of honourable mention is a priceless, very quick cameo with Pat Morita, which is an absolute gem. There are other assorted scenarios that came off well, too. See it if you must on a rainy Sunday, but this is pretty old, borrowed and blue.","Negative",0,"Train",25019,"2025-04-26T16:26:03.940832Z","http://www.imdb.com/title/tt0117723/usercomments"
72,"1","2025-04-26T16:26:33.392553Z","./train/unsup/9132_0.txt","",9132,29.307,"","Reportedly five years in the making, this enchanted, inspired production is perhaps not quite on the level of Disney's first-tier masterpieces (Pinocchio, Dumbo, Snow White and Fantasia), but a strong case could be made for it being the best film the studio has released since its 1991 premiere. From the design of the Beast's awesomely monolithic castle to the heart-stopping, Busby Berkley-inspired dance of china and silver in ""Be Our Guest"", this is one of the most rigorously constructed animated films I've seen. Bolstered by grand, romantic themes of self-sacrifice and eternal honor in the face of persecution, this is a marvelous experience for any age.","Positive",0,"Train",25020,"2025-04-26T16:26:33.392564Z","http://www.imdb.com/title/tt0101414/usercomments"
73,"1","2025-04-26T16:28:54.599968Z","./train/unsup/46312_0.txt","[{""start"":9,""end"":62,""text"":""want to give it a ten for being so perfectly horrible"",""labels"":[""positive""]},{""start"":63,""end"":123,""text"":""but the fact that he takes this so seriously makes it so bad"",""labels"":[""negative""]},{""start"":342,""end"":384,""text"":""It's plain awful from a musical standpoint "",""labels"":[""negative""]},{""start"":385,""end"":470,""text"":""but the fact that it's a farcical, unintentional laugh riot, makes it totally awesome"",""labels"":[""positive""]}]",46312,141.068,"Edge case","I almost want to give it a ten for being so perfectly horrible but the fact that he takes this so seriously makes it so bad. I can't help but watch it. It's great! I'll be waiting for the next 2000 chapters, but he calls it ""hip-hopera"". There is no movement to the music after a chapter ends, he rhymes the same word several times in a row. It's plain awful from a musical standpoint but the fact that it's a farcical, unintentional laugh riot, makes it totally awesome! My favorite line is when the midget (and i love that he's referred to as ""the midget"") says ""oh god, I think I just shitted on myself. How could he sing that line with a straight face?","Negative",0,"Train",25021,"2025-04-26T16:28:54.599981Z","http://www.imdb.com/title/tt0491587/usercomments"
74,"1","2025-04-26T16:29:13.195141Z","./train/unsup/38882_0.txt","",38882,18.433,"","I have seen at least four other films (including Michael Moore's documentary) about the guns in America, and their easy availability - three of these were about senseless shootings in schools. And now we have another. <br /><br />Unfortunately, this is the least interesting of the lot. Gus van Sant's ""Elephant"" tops the board in its classic understatement, and weaves disparate strands together in the end. With this movie, which dissects the aftermath of a school shooting starts off with a tantalising premise - what happens AFTER? <br /><br />It is almost too horrible to bear, the mother (a marvelous performance by Marcia Gay Harden) of a shooter in a school massacre, the traumatised police officer, the headmaster who is so intent on stopping guns in schools that he neglects (oh cliché cliché!) his own family and so on are all formulaic plot devices at the best. The performances by the main actors are really good, but the poor material they have been given negates all.<br /><br />There is no sense of interconnectivity between the individual subplots, not really even at the end, when a totally gratuitous bit of violence brings just two of the sub-plot protagonists accidentally together.<br /><br />The movie builds up to nothing, and so ends with a big SO WHAT?","Negative",0,"Train",25022,"2025-04-26T16:29:13.195152Z","http://www.imdb.com/title/tt0416471/usercomments"
75,"1","2025-04-26T16:29:22.809751Z","./train/unsup/29465_0.txt","",29465,9.47,"","The movie is badly directed though a good story and Vivek Oberoi cannot act. Please buy the movie if you want an example of how not to direct a movie.So see it at you own risk. The use of actresses has been poor. The feel of an old lady coming back to India in search of her love did not sell too well. But I haven't seen any brilliant work from the director in the recent times except for Iqbal which he produced. The movie had everything that makes a commercial success, it is a period movie it was quiet well done, songs were out of the world the two best music directors Rehman and Ismail Darbar and a commercial cast,the dances were choreographed by S.Dawar group the best dancing school available if you add all this with a good story a very good film!!!!! To make a flop with all this is and art by itself. Please buy this copy to see how not to do it.","Negative",0,"Train",25023,"2025-04-26T16:29:22.809762Z","http://www.imdb.com/title/tt0396690/usercomments"
76,"1","2025-04-26T16:34:13.138515Z","./train/unsup/30558_0.txt","[{""start"":1841,""end"":2042,""text"":""This gruesome and captivating story of revenge is - yes- a SPAGHETTI WESTERN. Every trick in the Spaghetti-Western handbook. And I mean it as a compliment.This is on par with Sergio Leone on a good day"",""labels"":[""positive""]},{""start"":2394,""end"":2442,""text"":""This is an Arctic homage to Sergio Leone. Bravo!"",""labels"":[""positive""]},{""start"":2777,""end"":2895,""text"":""And those were all the flaws. I mean ALL the flaws. The\\is film is so frikkin' strong none of the above really matters"",""labels"":[""positive""]},{""start"":99,""end"":127,""text"":""And what an OUTSTANDING film"",""labels"":[""positive""]},{""start"":1106,""end"":1238,""text"":""An Icelandic film about vikings? A chance to show off Icelandic courage, virtue and heroism, right? Wrong. The hero is from IRELAND,"",""labels"":[""negative""]}]",30558,290.19,"Contradictory on first reading. Sounds negative, but is actually positive. Edge case?","The only Icelandic film I've ever come across. This and it's two (disappointing) sequels, that is. And what an OUTSTANDING film. Wow. The viking film to end all viking films. None of the others made since (Trees Grow on the Stones Too, 13 Warrior, The Pathfinder *yikes!*, the sequels to this film) have been up to much. <br /><br />Five VIRTUES of When The Raven Flies:<br /><br />1. Design wise: The viking clichés of (horned) helmets, shiny swords, dragon headed longboats, and the odd galloping stallions are replaced with an authentic, down-to-earth design: Fur caps, black/rusty cleavers/knives, small ocean going merchant vessels, and those curious Icelandic ponies. It is quite odd seeing the characters ride them. The viking warriors feet almost touch the ground, and they ride in a weird trotting style. <br /><br />Which help bring us closer to what life could have been like back then.<br /><br />And did I mention how the director has chosen memorable, gritty faces in almost every role? No tall blond semi-gods here, just dirty survivors in a harsh country/island. <br /><br />2. Plot wise: An Icelandic film about vikings? A chance to show off Icelandic courage, virtue and heroism, right? Wrong. The hero is from IRELAND, rather, and his story is about a viking victim getting back at the perpetrators. <br /><br />The plot requires minimum knowledge about Icelandic/Norwegian history. It's set during the late 800s AD. While the political power in Norway is being consolidated around one king, Iceland is being colonized by settlers, hunters, traders, political refugees...and Irish slaves. Iceland was considered a loose and distant part of the young kingdom.<br /><br />The intrigue be a little hard to follow a first. Relax - it will all make sense later on (as characters dwindle in number). <br /><br />3. Style wise: This gruesome and captivating story of revenge is - yes- a SPAGHETTI WESTERN. Every trick in the Spaghetti-Western handbook. And I mean it as a compliment.This is on par with Sergio Leone on a good day. And how suitable for the material. Talking is kept to a macho minimum. Closeups of frowning faces and steely eyes trying to penetrate the minds of opponents. Quiet. Sudden violent outbursts. Bittersweet ending. The main character, ""Guest"", isn't even presented with a proper name. Clint's nameless character in the Dollar movies, anyone? <br /><br />This is an Arctic homage to Sergio Leone. Bravo!<br /><br />4. Endurance: 24 years on and the film is still standing strong. Some bloods'n gore effects are little on the silly side, some sophomore editing. Some synth music and ditto drums upsets the mood a little at times. My DVD version has no stereo/surround sound. The picture is laser disc fine, not DVD or HD fine. <br /><br />And those were all the flaws. I mean ALL the flaws. The\is film is so frikkin' strong none of the above really matters.<br /><br />5. The director still hasn't made anything nearly as impressive as this film. The 1988 sequel, In the Shadow of the Raven, had a bigger budget/production. But lacks the Leone-ish sense of urgency. See for yourself. The last film in his trilogy, Den Kvite Viking, had moments of inspired casting/design/mood etc (a talking wooden Jesus effigy stands out), but is totally overwhelmed by a slow and unconvincing plot. Shame. The more reason to love and revere the original! <br /><br />See it before they cast Nicholas Cage in a remake!","Positive",0,"Train",25024,"2025-04-26T16:34:13.138547Z","http://www.imdb.com/title/tt0087432/usercomments"
77,"1","2025-04-26T16:34:20.410656Z","./train/unsup/29776_0.txt","",29776,7.103,"","This movie stole 2 hours of my life and I want them back! I kept watching, hoping against hope, that something would happen in the film to redeem itself, but alas, it was not to be. Watching this movie is the cinematic equivalent of a root canal. And for a movie so full of sex, this is about the least erotic thing I can imagine.<br /><br />While Isabelle Huppert is an undeniably talented and beautiful actress, I can not comprehend what would possess her to star in a film like this. This movie is full of unpleasant people doing unpleasant things, for no discernible reason other than to annoy the viewer. None of the characters are remotely realistic, and their actions and motivations make no sense. In a real world, Isabelle Huppert's character would have been imprisoned and/or institutionalized.<br /><br />The basic story is this: boy goes to live with his parents, dad dies, son pees all over his dad's stuff and masturbates, mom sniffs her son's butt, mom decides to introduce son to a world of sexual deviance and perversion (including participating in group sex with him), mom decides she should leave before the two of them actually have sex (but she conveniently leaves a whore behind for son to fall in love with), mom continues her career as a prostitute, son and whore whip the local restaurateur and cry, mom comes home to cause more trouble, and then mom dies and son masturbates at her coffin.<br /><br />There, I just saved you two hours and quite a few brain cells.","Negative",0,"Train",25025,"2025-04-26T16:34:20.410670Z","http://www.imdb.com/title/tt0381392/usercomments"
